cwe_id,name,score,search_source
79,Improper Neutralization of Input During Web Page Generation ('Cross-site Scripting'),9872.117286916598,base_query
116,Improper Encoding or Escaping of Output,9811.67362721844,base_query
113,Improper Neutralization of CRLF Sequences in HTTP Headers ('HTTP Request/Response Splitting'),9648.66025339418,base_query
200,Exposure of Sensitive Information to an Unauthorized Actor,9059.31418282048,base_query
138,Improper Neutralization of Special Elements,9035.597775248214,base_query
