cwe_id,name,score,search_source
116,Improper Encoding or Escaping of Output,11704.902567198418,unknown
138,Improper Neutralization of Special Elements,11509.905129552473,unknown
79,Improper Neutralization of Input During Web Page Generation ('Cross-site Scripting'),11287.283516646117,unknown
22,Improper Limitation of a Pathname to a Restricted Directory ('Path Traversal'),11218.515635428443,unknown
88,Improper Neutralization of Argument Delimiters in a Command ('Argument Injection'),10956.036817942904,unknown
