cwe_id,name,score,search_source
79,Improper Neutralization of Input During Web Page Generation ('Cross-site Scripting'),7762.827062277657,base_query
444,Inconsistent Interpretation of HTTP Requests ('HTTP Request/Response Smuggling'),7730.823269286428,base_query
113,Improper Neutralization of CRLF Sequences in HTTP Headers ('HTTP Request/Response Splitting'),7430.9300779808045,base_query
116,Improper Encoding or Escaping of Output,7422.393153248039,base_query
138,Improper Neutralization of Special Elements,7362.870292155006,base_query
