cwe_id,name,score,search_source
22,Improper Limitation of a Pathname to a Restricted Directory ('Path Traversal'),7588.947521368466,base_query
1336,Improper Neutralization of Special Elements Used in a Template Engine,7549.171666488739,base_query
184,Incomplete List of Disallowed Inputs,7451.327880817547,base_query
88,Improper Neutralization of Argument Delimiters in a Command ('Argument Injection'),7405.626011079464,base_query
116,Improper Encoding or Escaping of Output,7198.853669286353,base_query
