cwe_id,name,score,search_source
88,Improper Neutralization of Argument Delimiters in a Command ('Argument Injection'),7290.891491046425,base_query
116,Improper Encoding or Escaping of Output,7260.584116075259,base_query
95,Improper Neutralization of Directives in Dynamically Evaluated Code ('Eval Injection'),6966.4452765836795,base_query
138,Improper Neutralization of Special Elements,6931.872584805959,base_query
94,Improper Control of Generation of Code ('Code Injection'),6735.819587056473,base_query
