cwe_id,name,score,search_source
116,Improper Encoding or Escaping of Output,7195.1559109523705,base_query
88,Improper Neutralization of Argument Delimiters in a Command ('Argument Injection'),7149.585007104366,base_query
138,Improper Neutralization of Special Elements,6876.478727716625,base_query
95,Improper Neutralization of Directives in Dynamically Evaluated Code ('Eval Injection'),6851.917156180309,base_query
943,Improper Neutralization of Special Elements in Data Query Logic,6808.675152815512,base_query
