cwe_id,name,score,search_source
88,Improper Neutralization of Argument Delimiters in a Command ('Argument Injection'),8714.646017963281,unknown
79,Improper Neutralization of Input During Web Page Generation ('Cross-site Scripting'),8644.032099072929,unknown
116,Improper Encoding or Escaping of Output,8435.351009730504,unknown
138,Improper Neutralization of Special Elements,8330.695920140306,unknown
74,Improper Neutralization of Special Elements in Output Used by a Downstream Component ('Injection'),8258.129149675871,unknown
