cwe_id,name,score,search_source
116,Improper Encoding or Escaping of Output,11704.902567198418,base_query
138,Improper Neutralization of Special Elements,11509.905129552473,base_query
79,Improper Neutralization of Input During Web Page Generation ('Cross-site Scripting'),11287.283516646117,base_query
22,Improper Limitation of a Pathname to a Restricted Directory ('Path Traversal'),11218.515635428443,base_query
88,Improper Neutralization of Argument Delimiters in a Command ('Argument Injection'),10956.036817942904,base_query
