cwe_id,name,score,search_source
88,Improper Neutralization of Argument Delimiters in a Command ('Argument Injection'),8194.554839383918,base_query
79,Improper Neutralization of Input During Web Page Generation ('Cross-site Scripting'),8097.1650806825755,base_query
116,Improper Encoding or Escaping of Output,8078.228121761315,base_query
138,Improper Neutralization of Special Elements,7991.495362042543,base_query
74,Improper Neutralization of Special Elements in Output Used by a Downstream Component ('Injection'),7842.540002921514,base_query
