cwe_id,name,score,search_source
116,Improper Encoding or Escaping of Output,10762.561565082582,base_query
79,Improper Neutralization of Input During Web Page Generation ('Cross-site Scripting'),10558.857887016888,base_query
138,Improper Neutralization of Special Elements,10293.345096970106,base_query
88,Improper Neutralization of Argument Delimiters in a Command ('Argument Injection'),10252.429734709222,base_query
74,Improper Neutralization of Special Elements in Output Used by a Downstream Component ('Injection'),10229.21552895275,base_query
