cwe_id,name,score,search_source
113,Improper Neutralization of CRLF Sequences in HTTP Headers ('HTTP Request/Response Splitting'),8981.281077182755,unknown
79,Improper Neutralization of Input During Web Page Generation ('Cross-site Scripting'),8841.067583343636,unknown
444,Inconsistent Interpretation of HTTP Requests ('HTTP Request/Response Smuggling'),8702.534800391133,unknown
116,Improper Encoding or Escaping of Output,8481.45717064979,unknown
611,Improper Restriction of XML External Entity Reference,8437.731118227774,unknown
