cwe_id,name,score,search_source
116,Improper Encoding or Escaping of Output,10220.239397707794,unknown
79,Improper Neutralization of Input During Web Page Generation ('Cross-site Scripting'),9901.997619183378,unknown
138,Improper Neutralization of Special Elements,9687.542699051333,unknown
22,Improper Limitation of a Pathname to a Restricted Directory ('Path Traversal'),9436.676355272648,unknown
88,Improper Neutralization of Argument Delimiters in a Command ('Argument Injection'),9408.24389870793,unknown
