cwe_id,name,score,search_source
79,Improper Neutralization of Input During Web Page Generation ('Cross-site Scripting'),9504.890548471003,base_query
22,Improper Limitation of a Pathname to a Restricted Directory ('Path Traversal'),9489.671137759042,base_query
88,Improper Neutralization of Argument Delimiters in a Command ('Argument Injection'),9321.160325804356,base_query
116,Improper Encoding or Escaping of Output,9311.110534654463,base_query
138,Improper Neutralization of Special Elements,9246.37373725544,base_query
