cwe_id,name,score,search_source
113,Improper Neutralization of CRLF Sequences in HTTP Headers ('HTTP Request/Response Splitting'),5666.579811304301,base_query
444,Inconsistent Interpretation of HTTP Requests ('HTTP Request/Response Smuggling'),5489.282980252272,base_query
754,Improper Check for Unusual or Exceptional Conditions,5302.920556771976,base_query
770,Allocation of Resources Without Limits or Throttling,4862.539276956773,base_query
755,Improper Handling of Exceptional Conditions,4860.344010835038,base_query
