cwe_id,name,score,search_source
79,Improper Neutralization of Input During Web Page Generation ('Cross-site Scripting'),8637.732405926736,unknown
1336,Improper Neutralization of Special Elements Used in a Template Engine,8596.700578185422,unknown
116,Improper Encoding or Escaping of Output,8467.024562599714,unknown
74,Improper Neutralization of Special Elements in Output Used by a Downstream Component ('Injection'),8351.059486351427,unknown
138,Improper Neutralization of Special Elements,8337.254885207694,unknown
