cwe_id,name,score,search_source
22,Improper Limitation of a Pathname to a Restricted Directory ('Path Traversal'),9728.67660120181,unknown
79,Improper Neutralization of Input During Web Page Generation ('Cross-site Scripting'),9691.909848830433,unknown
88,Improper Neutralization of Argument Delimiters in a Command ('Argument Injection'),9531.144901478303,unknown
74,Improper Neutralization of Special Elements in Output Used by a Downstream Component ('Injection'),9476.380738639398,unknown
116,Improper Encoding or Escaping of Output,9466.092953084004,unknown
