cwe_id,name,score,search_source
611,Improper Restriction of XML External Entity Reference,5652.886207173272,base_query
88,Improper Neutralization of Argument Delimiters in a Command ('Argument Injection'),5548.095269522712,base_query
116,Improper Encoding or Escaping of Output,5454.516499219429,base_query
95,Improper Neutralization of Directives in Dynamically Evaluated Code ('Eval Injection'),5449.100493719046,base_query
94,Improper Control of Generation of Code ('Code Injection'),5436.666053360167,base_query
