cwe_id,name,score,search_source
113,Improper Neutralization of CRLF Sequences in HTTP Headers ('HTTP Request/Response Splitting'),9055.050146582473,unknown
79,Improper Neutralization of Input During Web Page Generation ('Cross-site Scripting'),8945.481897421754,unknown
444,Inconsistent Interpretation of HTTP Requests ('HTTP Request/Response Smuggling'),8767.958828731986,unknown
116,Improper Encoding or Escaping of Output,8502.817380996046,unknown
611,Improper Restriction of XML External Entity Reference,8481.017558258385,unknown
