cwe_id,name,score,search_source
88,Improper Neutralization of Argument Delimiters in a Command ('Argument Injection'),9115.251733079822,unknown
22,Improper Limitation of a Pathname to a Restricted Directory ('Path Traversal'),9115.134660359325,unknown
95,Improper Neutralization of Directives in Dynamically Evaluated Code ('Eval Injection'),8803.006445646244,unknown
138,Improper Neutralization of Special Elements,8723.437394839173,unknown
116,Improper Encoding or Escaping of Output,8699.723255567596,unknown
