cwe_id,name,score,search_source
88,Improper Neutralization of Argument Delimiters in a Command ('Argument Injection'),7851.101152329484,unknown
116,Improper Encoding or Escaping of Output,7625.232078034825,unknown
138,Improper Neutralization of Special Elements,7523.735569005583,unknown
95,Improper Neutralization of Directives in Dynamically Evaluated Code ('Eval Injection'),7409.882063822413,unknown
22,Improper Limitation of a Pathname to a Restricted Directory ('Path Traversal'),7378.008482389778,unknown
