cwe_id,name,score,search_source
116,Improper Encoding or Escaping of Output,9099.061262865496,base_query
79,Improper Neutralization of Input During Web Page Generation ('Cross-site Scripting'),8816.446405676794,base_query
451,User Interface (UI) Misrepresentation of Critical Information,8291.804731185666,base_query
138,Improper Neutralization of Special Elements,8284.918128318113,base_query
88,Improper Neutralization of Argument Delimiters in a Command ('Argument Injection'),8257.831448977886,base_query
