cwe_id,name,score,search_source
74,Improper Neutralization of Special Elements in Output Used by a Downstream Component ('Injection'),9644.442930908806,unknown
79,Improper Neutralization of Input During Web Page Generation ('Cross-site Scripting'),9453.33610965521,unknown
116,Improper Encoding or Escaping of Output,9091.23977315867,unknown
88,Improper Neutralization of Argument Delimiters in a Command ('Argument Injection'),9060.529289632099,unknown
22,Improper Limitation of a Pathname to a Restricted Directory ('Path Traversal'),9047.201394633541,unknown
