cwe_id,name,score,search_source
79,Improper Neutralization of Input During Web Page Generation ('Cross-site Scripting'),9701.205519229683,unknown
22,Improper Limitation of a Pathname to a Restricted Directory ('Path Traversal'),9659.2080425924,unknown
88,Improper Neutralization of Argument Delimiters in a Command ('Argument Injection'),9499.595767645229,unknown
116,Improper Encoding or Escaping of Output,9489.134629874077,unknown
138,Improper Neutralization of Special Elements,9449.57738264403,unknown
