cwe_id,name,score,search_source
22,Improper Limitation of a Pathname to a Restricted Directory ('Path Traversal'),7287.402354606496,base_query
1336,Improper Neutralization of Special Elements Used in a Template Engine,7222.69947393458,base_query
470,Use of Externally-Controlled Input to Select Classes or Code ('Unsafe Reflection'),7125.535475323644,base_query
88,Improper Neutralization of Argument Delimiters in a Command ('Argument Injection'),7043.999410411603,base_query
502,Deserialization of Untrusted Data,6999.312584112702,base_query
