cwe_id,name,score,search_source
116,Improper Encoding or Escaping of Output,8578.424272320959,unknown
88,Improper Neutralization of Argument Delimiters in a Command ('Argument Injection'),8410.040260000338,unknown
95,Improper Neutralization of Directives in Dynamically Evaluated Code ('Eval Injection'),8075.4814915139505,unknown
138,Improper Neutralization of Special Elements,8045.173092451509,unknown
22,Improper Limitation of a Pathname to a Restricted Directory ('Path Traversal'),7919.006433535584,unknown
