cwe_id,name,score,search_source
113,Improper Neutralization of CRLF Sequences in HTTP Headers ('HTTP Request/Response Splitting'),7438.372621012228,base_query
444,Inconsistent Interpretation of HTTP Requests ('HTTP Request/Response Smuggling'),7120.7579910021595,base_query
116,Improper Encoding or Escaping of Output,7030.481574021101,base_query
93,Improper Neutralization of CRLF Sequences ('CRLF Injection'),7015.20236096829,base_query
88,Improper Neutralization of Argument Delimiters in a Command ('Argument Injection'),6951.3879727211815,base_query
