cwe_id,name,score,search_source
116,Improper Encoding or Escaping of Output,8034.144624814669,unknown
88,Improper Neutralization of Argument Delimiters in a Command ('Argument Injection'),7980.548156687254,unknown
22,Improper Limitation of a Pathname to a Restricted Directory ('Path Traversal'),7858.174740855487,unknown
138,Improper Neutralization of Special Elements,7467.575512415618,unknown
78,Improper Neutralization of Special Elements used in an OS Command ('OS Command Injection'),7374.059156454327,unknown
