cwe_id,name,score,search_source
22,Improper Limitation of a Pathname to a Restricted Directory ('Path Traversal'),9984.031332643546,base_query
79,Improper Neutralization of Input During Web Page Generation ('Cross-site Scripting'),9983.919912855035,base_query
88,Improper Neutralization of Argument Delimiters in a Command ('Argument Injection'),9779.41902499645,base_query
116,Improper Encoding or Escaping of Output,9747.096862053746,base_query
74,Improper Neutralization of Special Elements in Output Used by a Downstream Component ('Injection'),9736.794066958035,base_query
