cwe_id,name,score,search_source
22,Improper Limitation of a Pathname to a Restricted Directory ('Path Traversal'),9828.723035595583,unknown
79,Improper Neutralization of Input During Web Page Generation ('Cross-site Scripting'),9782.858168167346,unknown
88,Improper Neutralization of Argument Delimiters in a Command ('Argument Injection'),9614.319976616189,unknown
74,Improper Neutralization of Special Elements in Output Used by a Downstream Component ('Injection'),9582.957931496216,unknown
116,Improper Encoding or Escaping of Output,9560.786450316044,unknown
