cwe_id,name,score,search_source
113,Improper Neutralization of CRLF Sequences in HTTP Headers ('HTTP Request/Response Splitting'),8850.917164485216,base_query
79,Improper Neutralization of Input During Web Page Generation ('Cross-site Scripting'),8742.92850378569,base_query
444,Inconsistent Interpretation of HTTP Requests ('HTTP Request/Response Smuggling'),8608.804976135349,base_query
116,Improper Encoding or Escaping of Output,8327.662989025841,base_query
611,Improper Restriction of XML External Entity Reference,8326.12802728312,base_query
