cwe_id,name,score,search_source
22,Improper Limitation of a Pathname to a Restricted Directory ('Path Traversal'),9220.870438236767,base_query
1336,Improper Neutralization of Special Elements Used in a Template Engine,9130.187118389607,base_query
138,Improper Neutralization of Special Elements,9011.97210533328,base_query
116,Improper Encoding or Escaping of Output,9008.889358487042,base_query
88,Improper Neutralization of Argument Delimiters in a Command ('Argument Injection'),8995.102515459792,base_query
