cwe_id,name,score,search_source
22,Improper Limitation of a Pathname to a Restricted Directory ('Path Traversal'),8300.23253758544,base_query
184,Incomplete List of Disallowed Inputs,8181.69570717205,base_query
88,Improper Neutralization of Argument Delimiters in a Command ('Argument Injection'),7952.783375381908,base_query
917,Improper Neutralization of Special Elements used in an Expression Language Statement ('Expression Language Injection'),7851.16897036254,base_query
770,Allocation of Resources Without Limits or Throttling,7798.32614004816,base_query
