cwe_id,name,score,search_source
22,Improper Limitation of a Pathname to a Restricted Directory ('Path Traversal'),9984.031332643546,unknown
79,Improper Neutralization of Input During Web Page Generation ('Cross-site Scripting'),9983.919912855035,unknown
88,Improper Neutralization of Argument Delimiters in a Command ('Argument Injection'),9779.41902499645,unknown
116,Improper Encoding or Escaping of Output,9747.096862053746,unknown
74,Improper Neutralization of Special Elements in Output Used by a Downstream Component ('Injection'),9736.794066958035,unknown
