cwe_id,name,score,search_source
88,Improper Neutralization of Argument Delimiters in a Command ('Argument Injection'),9136.029122516535,base_query
116,Improper Encoding or Escaping of Output,8869.459278350449,base_query
79,Improper Neutralization of Input During Web Page Generation ('Cross-site Scripting'),8864.832820394862,base_query
138,Improper Neutralization of Special Elements,8860.164458235446,base_query
74,Improper Neutralization of Special Elements in Output Used by a Downstream Component ('Injection'),8669.684122877938,base_query
