cwe_id,name,score,search_source
116,Improper Encoding or Escaping of Output,7457.715882718066,unknown
22,Improper Limitation of a Pathname to a Restricted Directory ('Path Traversal'),7382.428281194859,unknown
138,Improper Neutralization of Special Elements,7273.891420143823,unknown
88,Improper Neutralization of Argument Delimiters in a Command ('Argument Injection'),7252.202241154433,unknown
95,Improper Neutralization of Directives in Dynamically Evaluated Code ('Eval Injection'),7009.371480458982,unknown
