cwe_id,name,score,search_source
444,Inconsistent Interpretation of HTTP Requests ('HTTP Request/Response Smuggling'),6542.172430649156,base_query
22,Improper Limitation of a Pathname to a Restricted Directory ('Path Traversal'),6147.023319447078,base_query
113,Improper Neutralization of CRLF Sequences in HTTP Headers ('HTTP Request/Response Splitting'),6109.3827693351395,base_query
918,Server-Side Request Forgery (SSRF),6092.5642014238565,base_query
116,Improper Encoding or Escaping of Output,6084.90532231906,base_query
