cwe_id,name,score,search_source
113,Improper Neutralization of CRLF Sequences in HTTP Headers ('HTTP Request/Response Splitting'),8824.132231967455,unknown
79,Improper Neutralization of Input During Web Page Generation ('Cross-site Scripting'),8707.576416310269,unknown
444,Inconsistent Interpretation of HTTP Requests ('HTTP Request/Response Smuggling'),8593.81517183464,unknown
611,Improper Restriction of XML External Entity Reference,8303.232424933249,unknown
116,Improper Encoding or Escaping of Output,8292.703437679267,unknown
