cwe_id,name,score,search_source
116,Improper Encoding or Escaping of Output,9598.724369742145,base_query
79,Improper Neutralization of Input During Web Page Generation ('Cross-site Scripting'),9383.438380904889,base_query
88,Improper Neutralization of Argument Delimiters in a Command ('Argument Injection'),9161.89064621045,base_query
138,Improper Neutralization of Special Elements,9114.806920092537,base_query
74,Improper Neutralization of Special Elements in Output Used by a Downstream Component ('Injection'),9084.277259135943,base_query
