cwe_id,name,score,search_source
367,Time-of-check Time-of-use (TOCTOU) Race Condition,5703.345389961249,base_query
59,Improper Link Resolution Before File Access ('Link Following'),5698.353493428427,base_query
295,Improper Certificate Validation,5677.534173986815,base_query
923,Improper Restriction of Communication Channel to Intended Endpoints,5626.450799426812,base_query
362,Concurrent Execution using Shared Resource with Improper Synchronization ('Race Condition'),5614.3408715195865,base_query
