cwe_id,name,score,search_source
113,Improper Neutralization of CRLF Sequences in HTTP Headers ('HTTP Request/Response Splitting'),9822.203924429074,base_query
79,Improper Neutralization of Input During Web Page Generation ('Cross-site Scripting'),9700.175319295113,base_query
116,Improper Encoding or Escaping of Output,9594.094732290947,base_query
138,Improper Neutralization of Special Elements,9502.9466762717,base_query
22,Improper Limitation of a Pathname to a Restricted Directory ('Path Traversal'),9212.066633907563,base_query
