cwe_id,name,score,search_source
116,Improper Encoding or Escaping of Output,8662.897147462882,base_query
770,Allocation of Resources Without Limits or Throttling,8263.843661085039,base_query
88,Improper Neutralization of Argument Delimiters in a Command ('Argument Injection'),8234.275790495998,base_query
94,Improper Control of Generation of Code ('Code Injection'),8214.651193810803,base_query
22,Improper Limitation of a Pathname to a Restricted Directory ('Path Traversal'),8171.292152649736,base_query
