cwe_id,name,score,search_source
88,Improper Neutralization of Argument Delimiters in a Command ('Argument Injection'),6139.904715727911,base_query
138,Improper Neutralization of Special Elements,5661.573294832929,base_query
625,Permissive Regular Expression,5629.632208994982,base_query
78,Improper Neutralization of Special Elements used in an OS Command ('OS Command Injection'),5611.469014481601,base_query
93,Improper Neutralization of CRLF Sequences ('CRLF Injection'),5579.256365187302,base_query
