cwe_id,name,score,search_source
22,Improper Limitation of a Pathname to a Restricted Directory ('Path Traversal'),10186.630240392591,base_query
79,Improper Neutralization of Input During Web Page Generation ('Cross-site Scripting'),10067.922673643816,base_query
88,Improper Neutralization of Argument Delimiters in a Command ('Argument Injection'),9885.553109286491,base_query
74,Improper Neutralization of Special Elements in Output Used by a Downstream Component ('Injection'),9862.624396469953,base_query
116,Improper Encoding or Escaping of Output,9835.642995329446,base_query
