cwe_id,name,score,search_source
116,Improper Encoding or Escaping of Output,9710.894673643894,base_query
79,Improper Neutralization of Input During Web Page Generation ('Cross-site Scripting'),9684.18557294709,base_query
88,Improper Neutralization of Argument Delimiters in a Command ('Argument Injection'),9590.338948070092,base_query
138,Improper Neutralization of Special Elements,9533.48529969827,base_query
74,Improper Neutralization of Special Elements in Output Used by a Downstream Component ('Injection'),9288.878058210707,base_query
