cwe_id,name,score,search_source
1336,Improper Neutralization of Special Elements Used in a Template Engine,7648.631763047111,base_query
116,Improper Encoding or Escaping of Output,7365.646586131604,base_query
917,Improper Neutralization of Special Elements used in an Expression Language Statement ('Expression Language Injection'),7346.742158200173,base_query
94,Improper Control of Generation of Code ('Code Injection'),7171.802498629474,base_query
138,Improper Neutralization of Special Elements,7169.202012060057,base_query
