cwe_id,name,score,search_source
113,Improper Neutralization of CRLF Sequences in HTTP Headers ('HTTP Request/Response Splitting'),9028.875455907828,unknown
79,Improper Neutralization of Input During Web Page Generation ('Cross-site Scripting'),8948.257136082979,unknown
444,Inconsistent Interpretation of HTTP Requests ('HTTP Request/Response Smuggling'),8784.328383515305,unknown
611,Improper Restriction of XML External Entity Reference,8609.984993363554,unknown
116,Improper Encoding or Escaping of Output,8522.799229506185,unknown
