cwe_id,name,score,search_source
22,Improper Limitation of a Pathname to a Restricted Directory ('Path Traversal'),7464.6192354668365,base_query
1336,Improper Neutralization of Special Elements Used in a Template Engine,7457.148511857244,base_query
184,Incomplete List of Disallowed Inputs,7386.100844464394,base_query
138,Improper Neutralization of Special Elements,7227.917075425973,base_query
88,Improper Neutralization of Argument Delimiters in a Command ('Argument Injection'),7222.552688080329,base_query
