cwe_id,name,score,search_source
116,Improper Encoding or Escaping of Output,9193.435525982724,base_query
88,Improper Neutralization of Argument Delimiters in a Command ('Argument Injection'),8830.978345106156,base_query
79,Improper Neutralization of Input During Web Page Generation ('Cross-site Scripting'),8819.364020450037,base_query
138,Improper Neutralization of Special Elements,8785.962232063952,base_query
78,Improper Neutralization of Special Elements used in an OS Command ('OS Command Injection'),8486.894949121694,base_query
