cwe_id,name,score,search_source
79,Improper Neutralization of Input During Web Page Generation ('Cross-site Scripting'),8843.89521318728,base_query
113,Improper Neutralization of CRLF Sequences in HTTP Headers ('HTTP Request/Response Splitting'),8671.463972340543,base_query
116,Improper Encoding or Escaping of Output,8631.333254080186,base_query
942,Permissive Cross-domain Policy with Untrusted Domains,8244.65261997882,base_query
352,Cross-Site Request Forgery (CSRF),8177.956048244927,base_query
