cwe_id,name,score,search_source
427,Uncontrolled Search Path Element,11799.664738168267,unknown
88,Improper Neutralization of Argument Delimiters in a Command ('Argument Injection'),11014.660851056187,unknown
22,Improper Limitation of a Pathname to a Restricted Directory ('Path Traversal'),10998.068225254594,unknown
116,Improper Encoding or Escaping of Output,10993.967621199678,unknown
79,Improper Neutralization of Input During Web Page Generation ('Cross-site Scripting'),10784.312559622633,unknown
