cwe_id,name,score,search_source
22,Improper Limitation of a Pathname to a Restricted Directory ('Path Traversal'),9704.852875075705,unknown
79,Improper Neutralization of Input During Web Page Generation ('Cross-site Scripting'),9618.368935956132,unknown
88,Improper Neutralization of Argument Delimiters in a Command ('Argument Injection'),9420.177753975613,unknown
116,Improper Encoding or Escaping of Output,9398.625731190936,unknown
74,Improper Neutralization of Special Elements in Output Used by a Downstream Component ('Injection'),9379.461182523697,unknown
