cwe_id,name,score,search_source
335,Incorrect Usage of Seeds in Pseudo-Random Number Generator (PRNG),5948.521935922248,base_query
1321,Improperly Controlled Modification of Object Prototype Attributes ('Prototype Pollution'),5841.338742133196,base_query
88,Improper Neutralization of Argument Delimiters in a Command ('Argument Injection'),5711.322473990743,base_query
1333,Inefficient Regular Expression Complexity,5708.523112632232,base_query
427,Uncontrolled Search Path Element,5520.035826457306,base_query
