cwe_id,name,score,search_source
116,Improper Encoding or Escaping of Output,8890.257333178062,unknown
79,Improper Neutralization of Input During Web Page Generation ('Cross-site Scripting'),8627.288289732916,unknown
1336,Improper Neutralization of Special Elements Used in a Template Engine,8512.82449987511,unknown
138,Improper Neutralization of Special Elements,8450.249133857707,unknown
917,Improper Neutralization of Special Elements used in an Expression Language Statement ('Expression Language Injection'),8143.41531792923,unknown
