cwe_id,name,score,search_source
22,Improper Limitation of a Pathname to a Restricted Directory ('Path Traversal'),11797.059623130193,base_query
79,Improper Neutralization of Input During Web Page Generation ('Cross-site Scripting'),11661.547439779535,base_query
116,Improper Encoding or Escaping of Output,11611.531596392704,base_query
74,Improper Neutralization of Special Elements in Output Used by a Downstream Component ('Injection'),11601.970366640353,base_query
138,Improper Neutralization of Special Elements,11497.282961217366,base_query
