cwe_id,name,score,search_source
113,Improper Neutralization of CRLF Sequences in HTTP Headers ('HTTP Request/Response Splitting'),5530.007916493867,base_query
639,Authorization Bypass Through User-Controlled Key,5423.874046640524,base_query
209,Generation of Error Message Containing Sensitive Information,5238.146855594084,base_query
923,Improper Restriction of Communication Channel to Intended Endpoints,5134.366483275217,base_query
201,Insertion of Sensitive Information Into Sent Data,5110.9909356465705,base_query
