cwe_id,name,score,search_source
22,Improper Limitation of a Pathname to a Restricted Directory ('Path Traversal'),9609.61069160328,unknown
79,Improper Neutralization of Input During Web Page Generation ('Cross-site Scripting'),9586.820371565453,unknown
88,Improper Neutralization of Argument Delimiters in a Command ('Argument Injection'),9408.191283142918,unknown
116,Improper Encoding or Escaping of Output,9376.138607000885,unknown
74,Improper Neutralization of Special Elements in Output Used by a Downstream Component ('Injection'),9364.808370750476,unknown
