cwe_id,name,score,search_source
116,Improper Encoding or Escaping of Output,8708.556658550402,base_query
88,Improper Neutralization of Argument Delimiters in a Command ('Argument Injection'),8512.035215795657,base_query
95,Improper Neutralization of Directives in Dynamically Evaluated Code ('Eval Injection'),8207.878112131897,base_query
138,Improper Neutralization of Special Elements,8186.599595486724,base_query
22,Improper Limitation of a Pathname to a Restricted Directory ('Path Traversal'),8035.171494594621,base_query
