cwe_id,name,score,search_source
79,Improper Neutralization of Input During Web Page Generation ('Cross-site Scripting'),8639.70224432558,base_query
1336,Improper Neutralization of Special Elements Used in a Template Engine,8550.471062643977,base_query
116,Improper Encoding or Escaping of Output,8497.334532016404,base_query
88,Improper Neutralization of Argument Delimiters in a Command ('Argument Injection'),8447.874672704413,base_query
138,Improper Neutralization of Special Elements,8444.929823659646,base_query
