cwe_id,name,score,search_source
79,Improper Neutralization of Input During Web Page Generation ('Cross-site Scripting'),9617.871608986195,base_query
22,Improper Limitation of a Pathname to a Restricted Directory ('Path Traversal'),9600.611748820556,base_query
88,Improper Neutralization of Argument Delimiters in a Command ('Argument Injection'),9442.093956214469,base_query
116,Improper Encoding or Escaping of Output,9410.968678056524,base_query
74,Improper Neutralization of Special Elements in Output Used by a Downstream Component ('Injection'),9372.201906327484,base_query
