cwe_id,name,type,score
274,Improper Handling of Insufficient Privileges,Base,0.7566307829447598
653,Improper Isolation or Compartmentalization,Class,0.75626612270009
280,Improper Handling of Insufficient Permissions or Privileges ,Base,0.751485064250502
668,Exposure of Resource to Wrong Sphere,Class,0.7459218938719958
266,Incorrect Privilege Assignment,Base,0.7445114071996307
267,Privilege Defined With Unsafe Actions,Base,0.7441278460199922
404,Improper Resource Shutdown or Release,Class,0.7440923081242067
754,Improper Check for Unusual or Exceptional Conditions,Class,0.7421058183174248
667,Improper Locking,Class,0.7387869115884631
664,Improper Control of a Resource Through its Lifetime,Pillar,0.7377969392117494
