cwe_id,name,type,score
405,Asymmetric Resource Consumption (Amplification),Class,0.7790655892203269
404,Improper Resource Shutdown or Release,Class,0.7742065950533054
226,Sensitive Information in Resource Not Removed Before Reuse,Base,0.7686441288425474
789,Memory Allocation with Excessive Size Value,Variant,0.7635028693114203
407,Inefficient Algorithmic Complexity,Class,0.7631275274194638
799,Improper Control of Interaction Frequency,Class,0.759424781263633
664,Improper Control of a Resource Through its Lifetime,Pillar,0.758395098636417
74,Improper Neutralization of Special Elements in Output Used by a Downstream Component ('Injection'),Class,0.7566629511839321
667,Improper Locking,Class,0.7560658557478924
668,Exposure of Resource to Wrong Sphere,Class,0.7539313939386314
