cwe_id,name,type,score
754,Improper Check for Unusual or Exceptional Conditions,Class,0.7787435016638689
667,Improper Locking,Class,0.7709588823389899
668,Exposure of Resource to Wrong Sphere,Class,0.7583793619427012
404,Improper Resource Shutdown or Release,Class,0.7567167668473653
362,Concurrent Execution using Shared Resource with Improper Synchronization ('Race Condition'),Class,0.7559334979750336
703,Improper Check or Handling of Exceptional Conditions,Pillar,0.7557033441104648
755,Improper Handling of Exceptional Conditions,Class,0.7555065624002029
248,Uncaught Exception,Base,0.7550164554373612
203,Observable Discrepancy,Base,0.7515707876846851
280,Improper Handling of Insufficient Permissions or Privileges ,Base,0.7478200849278924
