cwe_id,name,type,score
1336,Improper Neutralization of Special Elements Used in a Template Engine,Base,0.7656578627815617
80,Improper Neutralization of Script-Related HTML Tags in a Web Page (Basic XSS),Variant,0.7595777386473292
74,Improper Neutralization of Special Elements in Output Used by a Downstream Component ('Injection'),Class,0.7576583429005448
917,Improper Neutralization of Special Elements used in an Expression Language Statement ('Expression Language Injection'),Base,0.7564673983359762
1289,Improper Validation of Unsafe Equivalence in Input,Base,0.7364813307087237
116,Improper Encoding or Escaping of Output,Class,0.7359937465502082
138,Improper Neutralization of Special Elements,Class,0.7332799739542564
184,Incomplete List of Disallowed Inputs,Base,0.7330299873579857
212,Improper Removal of Sensitive Information Before Storage or Transfer,Base,0.7258801054694599
639,Authorization Bypass Through User-Controlled Key,Base,0.7248794456026187
