cwe_id,name,type,score
80,Improper Neutralization of Script-Related HTML Tags in a Web Page (Basic XSS),Variant,0.7800930617408108
74,Improper Neutralization of Special Elements in Output Used by a Downstream Component ('Injection'),Class,0.7750462449569472
184,Incomplete List of Disallowed Inputs,Base,0.7662503254479606
838,Inappropriate Encoding for Output Context,Base,0.7641523851278899
138,Improper Neutralization of Special Elements,Class,0.7590827911803408
116,Improper Encoding or Escaping of Output,Class,0.757346877917481
917,Improper Neutralization of Special Elements used in an Expression Language Statement ('Expression Language Injection'),Base,0.757198485506473
1289,Improper Validation of Unsafe Equivalence in Input,Base,0.7547310467412713
96,Improper Neutralization of Directives in Statically Saved Code ('Static Code Injection'),Base,0.7471587369151965
1336,Improper Neutralization of Special Elements Used in a Template Engine,Base,0.74262356115627
