cwe_id,name,type,score
799,Improper Control of Interaction Frequency,Class,0.7903892577804112
405,Asymmetric Resource Consumption (Amplification),Class,0.7466602223023745
664,Improper Control of a Resource Through its Lifetime,Pillar,0.7347044999498804
1289,Improper Validation of Unsafe Equivalence in Input,Base,0.7325194943876524
606,Unchecked Input for Loop Condition,Base,0.7259887381074079
691,Insufficient Control Flow Management,Pillar,0.7248550035039261
653,Improper Isolation or Compartmentalization,Class,0.7233549575356699
184,Incomplete List of Disallowed Inputs,Base,0.7214410142017991
807,Reliance on Untrusted Inputs in a Security Decision,Base,0.7199050824611177
404,Improper Resource Shutdown or Release,Class,0.7192657433531178
