cwe_id,name,type,score
653,Improper Isolation or Compartmentalization,Class,0.7538137860227163
266,Incorrect Privilege Assignment,Base,0.7376801591630773
274,Improper Handling of Insufficient Privileges,Base,0.7372642352377188
664,Improper Control of a Resource Through its Lifetime,Pillar,0.7296765238431844
267,Privilege Defined With Unsafe Actions,Base,0.7213319427344271
280,Improper Handling of Insufficient Permissions or Privileges ,Base,0.7202969259214043
691,Insufficient Control Flow Management,Pillar,0.717559294295324
74,Improper Neutralization of Special Elements in Output Used by a Downstream Component ('Injection'),Class,0.7143269234515501
668,Exposure of Resource to Wrong Sphere,Class,0.7141561546307378
405,Asymmetric Resource Consumption (Amplification),Class,0.711822726056442
