cwe_id,name,type,score
404,Improper Resource Shutdown or Release,Class,0.7659271024914871
667,Improper Locking,Class,0.7553046590661542
226,Sensitive Information in Resource Not Removed Before Reuse,Base,0.7526685135163346
476,NULL Pointer Dereference,Base,0.7476504482196427
664,Improper Control of a Resource Through its Lifetime,Pillar,0.74434244439907
191,Integer Underflow (Wrap or Wraparound),Base,0.7368814279590663
170,Improper Null Termination,Base,0.7319606073366609
1325,Improperly Controlled Sequential Memory Allocation,Base,0.7288354537491308
789,Memory Allocation with Excessive Size Value,Variant,0.7281952725107486
754,Improper Check for Unusual or Exceptional Conditions,Class,0.7271496070077479
