cwe_id,name,type,score
404,Improper Resource Shutdown or Release,Class,0.7779316804618231
226,Sensitive Information in Resource Not Removed Before Reuse,Base,0.7694829003093973
668,Exposure of Resource to Wrong Sphere,Class,0.7654487381585284
667,Improper Locking,Class,0.7622302005265364
41,Improper Resolution of Path Equivalence,Base,0.7574058744701251
754,Improper Check for Unusual or Exceptional Conditions,Class,0.7552720100627595
703,Improper Check or Handling of Exceptional Conditions,Pillar,0.7547630992867581
610,Externally Controlled Reference to a Resource in Another Sphere,Class,0.7517828560804056
653,Improper Isolation or Compartmentalization,Class,0.7514671981567278
664,Improper Control of a Resource Through its Lifetime,Pillar,0.7506128533374729
