cwe_id,name,type,score
404,Improper Resource Shutdown or Release,Class,0.8087938117495208
667,Improper Locking,Class,0.7953828856564658
226,Sensitive Information in Resource Not Removed Before Reuse,Base,0.795216813896457
754,Improper Check for Unusual or Exceptional Conditions,Class,0.7915724489268501
664,Improper Control of a Resource Through its Lifetime,Pillar,0.786700580701146
274,Improper Handling of Insufficient Privileges,Base,0.7815806025796388
668,Exposure of Resource to Wrong Sphere,Class,0.77794708332667
280,Improper Handling of Insufficient Permissions or Privileges ,Base,0.777901612342143
755,Improper Handling of Exceptional Conditions,Class,0.7745257199495709
653,Improper Isolation or Compartmentalization,Class,0.7743120621383157
