cwe_id,name,type,score
404,Improper Resource Shutdown or Release,Class,0.7785237537815999
667,Improper Locking,Class,0.7700272403491014
405,Asymmetric Resource Consumption (Amplification),Class,0.7653590168470722
226,Sensitive Information in Resource Not Removed Before Reuse,Base,0.7623552862439607
664,Improper Control of a Resource Through its Lifetime,Pillar,0.7622934719443888
789,Memory Allocation with Excessive Size Value,Variant,0.7535685501589098
362,Concurrent Execution using Shared Resource with Improper Synchronization ('Race Condition'),Class,0.7517748423717441
1325,Improperly Controlled Sequential Memory Allocation,Base,0.7479706497414689
668,Exposure of Resource to Wrong Sphere,Class,0.7444074162260803
799,Improper Control of Interaction Frequency,Class,0.7437091417595179
