cwe_id,name,type,score
404,Improper Resource Shutdown or Release,Class,0.7987154728271585
226,Sensitive Information in Resource Not Removed Before Reuse,Base,0.7845820372670982
911,Improper Update of Reference Count,Base,0.7790302015298699
366,Race Condition within a Thread,Base,0.776496828454108
667,Improper Locking,Class,0.7666908473138185
362,Concurrent Execution using Shared Resource with Improper Synchronization ('Race Condition'),Class,0.7459546639440766
664,Improper Control of a Resource Through its Lifetime,Pillar,0.7440046014334976
772,Missing Release of Resource after Effective Lifetime,Base,0.7430020726246445
662,Improper Synchronization,Class,0.7427506144270302
415,Double Free,Variant,0.7416592345593067
