cwe_id,name,type,score
917,Improper Neutralization of Special Elements used in an Expression Language Statement ('Expression Language Injection'),Base,0.7986409028111836
1336,Improper Neutralization of Special Elements Used in a Template Engine,Base,0.7683765995407296
74,Improper Neutralization of Special Elements in Output Used by a Downstream Component ('Injection'),Class,0.7439944507056147
80,Improper Neutralization of Script-Related HTML Tags in a Web Page (Basic XSS),Variant,0.7391584505926978
184,Incomplete List of Disallowed Inputs,Base,0.7216257452458946
138,Improper Neutralization of Special Elements,Class,0.7171285380833639
96,Improper Neutralization of Directives in Statically Saved Code ('Static Code Injection'),Base,0.7129055657649332
1289,Improper Validation of Unsafe Equivalence in Input,Base,0.711022745626783
116,Improper Encoding or Escaping of Output,Class,0.7106012385219556
943,Improper Neutralization of Special Elements in Data Query Logic,Class,0.7103379045225737
