cwe_id,name,type,score
303,Incorrect Implementation of Authentication Algorithm,Base,0.7783435025846945
74,Improper Neutralization of Special Elements in Output Used by a Downstream Component ('Injection'),Class,0.7763972851300283
90,Improper Neutralization of Special Elements used in an LDAP Query ('LDAP Injection'),Base,0.7649263898388321
204,Observable Response Discrepancy,Base,0.7623258161472675
1390,Weak Authentication,Class,0.7612426313565019
639,Authorization Bypass Through User-Controlled Key,Base,0.7597178439663979
917,Improper Neutralization of Special Elements used in an Expression Language Statement ('Expression Language Injection'),Base,0.7557965050565605
212,Improper Removal of Sensitive Information Before Storage or Transfer,Base,0.7554979102627836
41,Improper Resolution of Path Equivalence,Base,0.7554014130470307
807,Reliance on Untrusted Inputs in a Security Decision,Base,0.7539006131237884
