cwe_id,name,type,score
404,Improper Resource Shutdown or Release,Class,0.7726265654340616
664,Improper Control of a Resource Through its Lifetime,Pillar,0.7658307859301359
405,Asymmetric Resource Consumption (Amplification),Class,0.7622333345610881
274,Improper Handling of Insufficient Privileges,Base,0.7622094936244335
668,Exposure of Resource to Wrong Sphere,Class,0.7570491810973964
280,Improper Handling of Insufficient Permissions or Privileges ,Base,0.7541838726850566
799,Improper Control of Interaction Frequency,Class,0.7532803652285526
653,Improper Isolation or Compartmentalization,Class,0.7518152441108097
226,Sensitive Information in Resource Not Removed Before Reuse,Base,0.7493370164337083
1220,Insufficient Granularity of Access Control,Base,0.7459975186479122
