cwe_id,name,type,score
405,Asymmetric Resource Consumption (Amplification),Class,0.7819292525569488
404,Improper Resource Shutdown or Release,Class,0.777513165717618
789,Memory Allocation with Excessive Size Value,Variant,0.7664289517094595
668,Exposure of Resource to Wrong Sphere,Class,0.7613337189022609
799,Improper Control of Interaction Frequency,Class,0.7607358788617071
639,Authorization Bypass Through User-Controlled Key,Base,0.7602556184053753
664,Improper Control of a Resource Through its Lifetime,Pillar,0.7581780543964345
226,Sensitive Information in Resource Not Removed Before Reuse,Base,0.7579950712193062
400,Uncontrolled Resource Consumption,Class,0.7566321805924023
770,Allocation of Resources Without Limits or Throttling,Base,0.7537789178647611
