cwe_id,name,type,score
74,Improper Neutralization of Special Elements in Output Used by a Downstream Component ('Injection'),Class,0.7746852706971381
99,Improper Control of Resource Identifiers ('Resource Injection'),Class,0.7602257561808419
184,Incomplete List of Disallowed Inputs,Base,0.7594644906863149
917,Improper Neutralization of Special Elements used in an Expression Language Statement ('Expression Language Injection'),Base,0.756326298293449
138,Improper Neutralization of Special Elements,Class,0.7439270316961345
1289,Improper Validation of Unsafe Equivalence in Input,Base,0.7339840087382121
41,Improper Resolution of Path Equivalence,Base,0.7334045988195192
653,Improper Isolation or Compartmentalization,Class,0.7318478263585362
80,Improper Neutralization of Script-Related HTML Tags in a Web Page (Basic XSS),Variant,0.7318409117575302
88,Improper Neutralization of Argument Delimiters in a Command ('Argument Injection'),Base,0.7303498236553313
