cwe_id,name,type,score
404,Improper Resource Shutdown or Release,Class,0.7848582552516514
667,Improper Locking,Class,0.7804441283231789
226,Sensitive Information in Resource Not Removed Before Reuse,Base,0.7751572683937576
362,Concurrent Execution using Shared Resource with Improper Synchronization ('Race Condition'),Class,0.7661943139709186
668,Exposure of Resource to Wrong Sphere,Class,0.7633420320618827
754,Improper Check for Unusual or Exceptional Conditions,Class,0.7630129255560532
662,Improper Synchronization,Class,0.7576825157964152
367,Time-of-check Time-of-use (TOCTOU) Race Condition,Base,0.7564611421838111
1289,Improper Validation of Unsafe Equivalence in Input,Base,0.7554753570393478
274,Improper Handling of Insufficient Privileges,Base,0.7546016152686552
