cwe_id,name,type,score
653,Improper Isolation or Compartmentalization,Class,0.7518619644727851
274,Improper Handling of Insufficient Privileges,Base,0.7305154994797783
266,Incorrect Privilege Assignment,Base,0.7259237897678923
664,Improper Control of a Resource Through its Lifetime,Pillar,0.725371377666958
691,Insufficient Control Flow Management,Pillar,0.7151489023094288
405,Asymmetric Resource Consumption (Amplification),Class,0.7120527163820776
280,Improper Handling of Insufficient Permissions or Privileges ,Base,0.7107454779677114
267,Privilege Defined With Unsafe Actions,Base,0.7106492466213179
74,Improper Neutralization of Special Elements in Output Used by a Downstream Component ('Injection'),Class,0.7086546058427095
668,Exposure of Resource to Wrong Sphere,Class,0.7067346870368116
