cwe_id,name,type,score
404,Improper Resource Shutdown or Release,Class,0.7633083977390286
280,Improper Handling of Insufficient Permissions or Privileges ,Base,0.7632995785055762
1289,Improper Validation of Unsafe Equivalence in Input,Base,0.7608179400544417
274,Improper Handling of Insufficient Privileges,Base,0.7601538378840971
266,Incorrect Privilege Assignment,Base,0.7600636247642012
667,Improper Locking,Class,0.7595329213258827
653,Improper Isolation or Compartmentalization,Class,0.7573755880948924
668,Exposure of Resource to Wrong Sphere,Class,0.7543710563163071
807,Reliance on Untrusted Inputs in a Security Decision,Base,0.7517663570139732
267,Privilege Defined With Unsafe Actions,Base,0.751280614640335
