cwe_id,name,type,score
1289,Improper Validation of Unsafe Equivalence in Input,Base,0.7816033090179932
404,Improper Resource Shutdown or Release,Class,0.776191352074795
366,Race Condition within a Thread,Base,0.7711789111959785
667,Improper Locking,Class,0.7703568048280303
226,Sensitive Information in Resource Not Removed Before Reuse,Base,0.7687794183807211
362,Concurrent Execution using Shared Resource with Improper Synchronization ('Race Condition'),Class,0.7654556286708404
911,Improper Update of Reference Count,Base,0.7611750538961576
367,Time-of-check Time-of-use (TOCTOU) Race Condition,Base,0.7611284716485385
843,Access of Resource Using Incompatible Type ('Type Confusion'),Base,0.7597958031622392
665,Improper Initialization,Class,0.75730908160659
