cwe_id,name,type,score
74,Improper Neutralization of Special Elements in Output Used by a Downstream Component ('Injection'),Class,0.7642600175970953
943,Improper Neutralization of Special Elements in Data Query Logic,Class,0.7595713563921116
1289,Improper Validation of Unsafe Equivalence in Input,Base,0.7521945992801474
184,Incomplete List of Disallowed Inputs,Base,0.7424847141803086
807,Reliance on Untrusted Inputs in a Security Decision,Base,0.7417358841794741
138,Improper Neutralization of Special Elements,Class,0.7412758600156549
80,Improper Neutralization of Script-Related HTML Tags in a Web Page (Basic XSS),Variant,0.73534075439505
917,Improper Neutralization of Special Elements used in an Expression Language Statement ('Expression Language Injection'),Base,0.7350893442892943
116,Improper Encoding or Escaping of Output,Class,0.7242959964696191
1236,Improper Neutralization of Formula Elements in a CSV File,Base,0.7233216946728034
