cwe_id,name,type,score
274,Improper Handling of Insufficient Privileges,Base,0.7438484026521581
807,Reliance on Untrusted Inputs in a Security Decision,Base,0.7423624266513592
280,Improper Handling of Insufficient Permissions or Privileges ,Base,0.7419205479424138
653,Improper Isolation or Compartmentalization,Class,0.7401187085220168
1220,Insufficient Granularity of Access Control,Base,0.7386723516751746
639,Authorization Bypass Through User-Controlled Key,Base,0.7344006387718897
267,Privilege Defined With Unsafe Actions,Base,0.7278906506282655
1390,Weak Authentication,Class,0.72662010583403
266,Incorrect Privilege Assignment,Base,0.7243459640049326
668,Exposure of Resource to Wrong Sphere,Class,0.7227761271679871
