cwe_id,name,type,score
404,Improper Resource Shutdown or Release,Class,0.793722187294649
667,Improper Locking,Class,0.7836864592298733
226,Sensitive Information in Resource Not Removed Before Reuse,Base,0.7796349035619311
909,Missing Initialization of Resource,Class,0.7718345767487672
362,Concurrent Execution using Shared Resource with Improper Synchronization ('Race Condition'),Class,0.7710617672844946
405,Asymmetric Resource Consumption (Amplification),Class,0.769356630211648
789,Memory Allocation with Excessive Size Value,Variant,0.7674006611568267
754,Improper Check for Unusual or Exceptional Conditions,Class,0.7670923180637639
908,Use of Uninitialized Resource,Base,0.764899756552781
664,Improper Control of a Resource Through its Lifetime,Pillar,0.7600790508205151
