cwe_id,name,type,score
404,Improper Resource Shutdown or Release,Class,0.7731818119699259
667,Improper Locking,Class,0.7553841191660965
226,Sensitive Information in Resource Not Removed Before Reuse,Base,0.7520764909143033
664,Improper Control of a Resource Through its Lifetime,Pillar,0.7509267891721274
703,Improper Check or Handling of Exceptional Conditions,Pillar,0.7461249776111336
668,Exposure of Resource to Wrong Sphere,Class,0.7434167015935884
754,Improper Check for Unusual or Exceptional Conditions,Class,0.7396977784315761
1289,Improper Validation of Unsafe Equivalence in Input,Base,0.7370867694991103
274,Improper Handling of Insufficient Privileges,Base,0.7340498332435087
755,Improper Handling of Exceptional Conditions,Class,0.7314623355396821
