cwe_id,name,type,score
1236,Improper Neutralization of Formula Elements in a CSV File,Base,0.7770543364503442
74,Improper Neutralization of Special Elements in Output Used by a Downstream Component ('Injection'),Class,0.7722743677028527
1336,Improper Neutralization of Special Elements Used in a Template Engine,Base,0.7643700227712054
138,Improper Neutralization of Special Elements,Class,0.7507800692949711
1289,Improper Validation of Unsafe Equivalence in Input,Base,0.7473833493886596
917,Improper Neutralization of Special Elements used in an Expression Language Statement ('Expression Language Injection'),Base,0.7471483842182544
639,Authorization Bypass Through User-Controlled Key,Base,0.7438162405051164
116,Improper Encoding or Escaping of Output,Class,0.7422732477024334
80,Improper Neutralization of Script-Related HTML Tags in a Web Page (Basic XSS),Variant,0.7408822753469512
502,Deserialization of Untrusted Data,Base,0.7369775740000247
